{
  "task_id": "spice_deck_debug_0080",
  "domain": "spice_deck_debug",
  "backend": "hspice",
  "tool_name": "Synopsys HSPICE",
  "tool_version_normalized": "unknown",
  "validation_status": "debug_contrast_verified",
  "validation_time_utc": "2026-06-12T04:29:23.479951+00:00",
  "notes": "Buggy exit=1, timed_out=False",
  "buggy_run": {
    "command_backend": "hspice",
    "expected_status": "fail",
    "actual_status": "fail",
    "exit_code": 1,
    "normalized_errors": [
      {
        "severity": "error",
        "category": "unsupported_dialect",
        "message": "**error** ([PATH]) Invalid model level   99 . Specify a valid model level."
      },
      {
        "severity": "error",
        "category": "unknown",
        "message": "***** job aborted"
      },
      {
        "severity": "error",
        "category": "unknown",
        "message": ">info:         ***** hspice job aborted"
      }
    ],
    "raw_log_sha256": "4dc1e3bfa0692da64bbeb87189ae322b4756fd0da8d54cf6df45fb674a2eb8bd",
    "raw_log_retained": true
  },
  "golden_run": {
    "command_backend": "hspice",
    "expected_status": "pass",
    "actual_status": "pass",
    "exit_code": 0,
    "normalized_errors": [
      {
        "severity": "warning",
        "category": "unknown",
        "message": "**warning** no tran outputs specified, analysis omitted"
      }
    ],
    "raw_log_sha256": "6ac63008a43ef4774a24492545fd845152bcd073f6a751a9c0c7ac56fff985ea",
    "raw_log_retained": true
  },
  "debug_contrast": {
    "buggy_failed_as_expected": true,
    "golden_passed_as_expected": true,
    "error_category_match": true,
    "expected_error_category": "unsupported_dialect",
    "observed_error_categories": [
      "unknown",
      "unsupported_dialect"
    ]
  },
  "parsed_metrics": {
    "elapsed_sec": 0.123
  }
}