{
  "task_id": "spice_deck_debug_0097",
  "domain": "spice_deck_debug",
  "backend": "hspice",
  "tool_name": "Synopsys HSPICE",
  "tool_version_normalized": "unknown",
  "validation_status": "debug_contrast_verified",
  "validation_time_utc": "2026-06-12T04:29:36.379461+00:00",
  "notes": "Buggy exit=255, timed_out=False",
  "buggy_run": {
    "command_backend": "hspice",
    "expected_status": "fail",
    "actual_status": "fail",
    "exit_code": 255,
    "normalized_errors": [
      {
        "severity": "error",
        "category": "invalid_directive",
        "message": "**error** ([PATH]) .lib should have a filename with correct section. Please enter filename with correct path and appropriate section. Syntax:.lib <./path/file name> (optional) < section> before or at "
      },
      {
        "severity": "error",
        "category": "unknown",
        "message": "***** job aborted"
      },
      {
        "severity": "error",
        "category": "unknown",
        "message": ">info:         ***** hspice job aborted"
      }
    ],
    "raw_log_sha256": "d566746fb262488411ddf15e299e39030759467428509408010674d4d25c3c41",
    "raw_log_retained": true
  },
  "golden_run": {
    "command_backend": "hspice",
    "expected_status": "pass",
    "actual_status": "pass",
    "exit_code": 0,
    "normalized_errors": [
      {
        "severity": "warning",
        "category": "unknown",
        "message": "**warning** no tran outputs specified, analysis omitted"
      }
    ],
    "raw_log_sha256": "fee44165452e8a04c689e5b29ad43749ae14551d590f9c886a7ca6a7ee0469a4",
    "raw_log_retained": true
  },
  "debug_contrast": {
    "buggy_failed_as_expected": true,
    "golden_passed_as_expected": true,
    "error_category_match": true,
    "expected_error_category": "invalid_directive",
    "observed_error_categories": [
      "invalid_directive",
      "unknown"
    ]
  },
  "parsed_metrics": {
    "elapsed_sec": 0.117
  }
}