{
  "task_id": "spice_deck_debug_0041",
  "domain": "spice_deck_debug",
  "backend": "hspice",
  "tool_name": "Synopsys HSPICE",
  "tool_version_normalized": "unknown",
  "validation_status": "debug_contrast_verified",
  "validation_time_utc": "2026-06-12T04:28:13.611030+00:00",
  "notes": "Buggy exit=1, timed_out=False",
  "buggy_run": {
    "command_backend": "hspice",
    "expected_status": "fail",
    "actual_status": "fail",
    "exit_code": 1,
    "normalized_errors": [
      {
        "severity": "error",
        "category": "duplicate_element",
        "message": "**error** attempts to redefine c1               at line        1 and line        2"
      },
      {
        "severity": "error",
        "category": "unknown",
        "message": "***** job aborted"
      },
      {
        "severity": "error",
        "category": "unknown",
        "message": ">error          ***** hspice job aborted"
      }
    ],
    "raw_log_sha256": "3a1eae2c994234c8ed309fc2a4151321a9be7bff91f0aeaa391ad0303a37846d",
    "raw_log_retained": true
  },
  "golden_run": {
    "command_backend": "hspice",
    "expected_status": "pass",
    "actual_status": "pass",
    "exit_code": 0,
    "normalized_errors": [
      {
        "severity": "warning",
        "category": "unknown",
        "message": "**warning** no tran outputs specified, analysis omitted"
      }
    ],
    "raw_log_sha256": "f5c97eea71c30cb0c00a5d8a336dc2eea16a121b149cb70cf1f9a1cd089b26c6",
    "raw_log_retained": true
  },
  "debug_contrast": {
    "buggy_failed_as_expected": true,
    "golden_passed_as_expected": true,
    "error_category_match": true,
    "expected_error_category": "duplicate_element",
    "observed_error_categories": [
      "duplicate_element",
      "unknown"
    ]
  },
  "parsed_metrics": {
    "elapsed_sec": 0.139
  }
}