{
  "task_id": "spice_deck_debug_0018",
  "domain": "spice_deck_debug",
  "backend": "hspice",
  "tool_name": "Synopsys HSPICE",
  "tool_version_normalized": "unknown",
  "validation_status": "debug_contrast_verified",
  "validation_time_utc": "2026-06-12T04:27:57.035815+00:00",
  "notes": "Buggy exit=1, timed_out=False",
  "buggy_run": {
    "command_backend": "hspice",
    "expected_status": "fail",
    "actual_status": "fail",
    "exit_code": 1,
    "normalized_errors": [
      {
        "severity": "error",
        "category": "missing_subckt",
        "message": "**error** ([PATH]) Definition of model/subckt \"buf\" is not found for the element \"x1\". Please specify a defined model/subckt name."
      },
      {
        "severity": "error",
        "category": "unknown",
        "message": "***** job aborted"
      },
      {
        "severity": "error",
        "category": "unknown",
        "message": ">error          ***** hspice job aborted"
      }
    ],
    "raw_log_sha256": "02f14e5c88f89feda523c64e6ce58f93ed9db99a5f79ea2bd5ad7922ac2e324c",
    "raw_log_retained": true
  },
  "golden_run": {
    "command_backend": "hspice",
    "expected_status": "pass",
    "actual_status": "pass",
    "exit_code": 0,
    "normalized_errors": [
      {
        "severity": "warning",
        "category": "unknown",
        "message": "**warning** no tran outputs specified, analysis omitted"
      }
    ],
    "raw_log_sha256": "5361389629ab8bfab0d749790798e4a64b5c5277e0f183571293706f615d9a73",
    "raw_log_retained": true
  },
  "debug_contrast": {
    "buggy_failed_as_expected": true,
    "golden_passed_as_expected": true,
    "error_category_match": true,
    "expected_error_category": "missing_subckt",
    "observed_error_categories": [
      "missing_subckt",
      "unknown"
    ]
  },
  "parsed_metrics": {
    "elapsed_sec": 0.132
  }
}