{
  "task_id": "spice_deck_debug_0007",
  "domain": "spice_deck_debug",
  "backend": "hspice",
  "tool_name": "Synopsys HSPICE",
  "tool_version_normalized": "unknown",
  "validation_status": "debug_contrast_verified",
  "validation_time_utc": "2026-06-12T04:27:49.277916+00:00",
  "notes": "Buggy exit=255, timed_out=False",
  "buggy_run": {
    "command_backend": "hspice",
    "expected_status": "fail",
    "actual_status": "fail",
    "exit_code": 255,
    "normalized_errors": [
      {
        "severity": "error",
        "category": "missing_model",
        "message": "**error** ([PATH]) definition of model drect not found. Please specify a defined model name."
      },
      {
        "severity": "error",
        "category": "unknown",
        "message": "***** job aborted"
      },
      {
        "severity": "error",
        "category": "unknown",
        "message": ">info:         ***** hspice job aborted"
      }
    ],
    "raw_log_sha256": "84dd20dcd9fd2322921ad26335eca9dcad9412a3f64bf46ab4c374d64687b467",
    "raw_log_retained": true
  },
  "golden_run": {
    "command_backend": "hspice",
    "expected_status": "pass",
    "actual_status": "pass",
    "exit_code": 0,
    "normalized_errors": [
      {
        "severity": "warning",
        "category": "unknown",
        "message": "**warning** no tran outputs specified, analysis omitted"
      }
    ],
    "raw_log_sha256": "5fcfe7fa8fbfb9d82ae0ae3d32f8349371548f1593e4831940a78c2223c36f8f",
    "raw_log_retained": true
  },
  "debug_contrast": {
    "buggy_failed_as_expected": true,
    "golden_passed_as_expected": true,
    "error_category_match": true,
    "expected_error_category": "missing_model",
    "observed_error_categories": [
      "missing_model",
      "unknown"
    ]
  },
  "parsed_metrics": {
    "elapsed_sec": 0.114
  }
}