{
  "task_id": "spice_deck_debug_0003",
  "domain": "spice_deck_debug",
  "backend": "hspice",
  "tool_name": "Synopsys HSPICE",
  "tool_version_normalized": "unknown",
  "validation_status": "debug_contrast_verified",
  "validation_time_utc": "2026-06-12T04:27:46.493345+00:00",
  "notes": "Buggy exit=1, timed_out=False",
  "buggy_run": {
    "command_backend": "hspice",
    "expected_status": "fail",
    "actual_status": "fail",
    "exit_code": 1,
    "normalized_errors": [
      {
        "severity": "error",
        "category": "missing_model",
        "message": "**error** ([PATH]) Definition of model/subckt \"pmos_typo\" is not found for the element \"m1\". Please specify a defined model/subckt name."
      },
      {
        "severity": "error",
        "category": "unknown",
        "message": "***** job aborted"
      },
      {
        "severity": "error",
        "category": "unknown",
        "message": ">error          ***** hspice job aborted"
      }
    ],
    "raw_log_sha256": "71ff3790e678f4b53ea8ae7cf541a9415ba04f76ffd4354a4df7c1f9c6671ae7",
    "raw_log_retained": true
  },
  "golden_run": {
    "command_backend": "hspice",
    "expected_status": "pass",
    "actual_status": "pass",
    "exit_code": 0,
    "normalized_errors": [
      {
        "severity": "warning",
        "category": "unknown",
        "message": "**warning** no tran outputs specified, analysis omitted"
      }
    ],
    "raw_log_sha256": "0c8c5b06e1bb25b064bf498d176846a341a9e368e697f013f5caa9b0686926a8",
    "raw_log_retained": true
  },
  "debug_contrast": {
    "buggy_failed_as_expected": true,
    "golden_passed_as_expected": true,
    "error_category_match": true,
    "expected_error_category": "missing_model",
    "observed_error_categories": [
      "missing_model",
      "unknown"
    ]
  },
  "parsed_metrics": {
    "elapsed_sec": 0.145
  }
}